{
  "$schema": "../../schemas/clause-definition.schema.json",
  "schema_version": "1.0.0",
  "clause_type": "Use, Occupancy and Conduct",
  "clause_name": "RLA-430 — Residential Lease — Parking and Vehicles",
  "zoho_api_name": null,
  "zoho_api_name_status": "tenant_verification_required",
  "library_question": "Do the source parking allowance and standard towing, vehicle-repair, and vehicle-risk provisions apply?",
  "contract_type_question_overrides": [],
  "language_variants": [
    {
      "variant_id": "standard",
      "variant_kind": "standard",
      "clause_title": "10.8. Parking",
      "clause_title_style": "Heading 2",
      "blocks": [
        {
          "style": "Normal",
          "text": "Tenant may use __________________ parking spaces, subject to HOA rules and availability. No specific stall is assigned or guaranteed unless Landlord states otherwise in writing. Vehicles must be operable, licensed, insured, and lawfully parked. Tenant and guests may not block driveways, dumpsters, sidewalks, fire lanes, other vehicles, access routes, or neighboring property."
        },
        {
          "style": "Heading 3",
          "text": "10.9. Parking Violations and Towing"
        },
        {
          "style": "Normal",
          "text": "A vehicle may be towed only to the extent permitted by applicable law and HOA authority. Any third-party tow requested by Landlord must comply with applicable notice, signage, police-notification, access, and fee requirements, including OPMC 12.21.030 where applicable. Nothing in this Lease authorizes a tow prohibited by law. Landlord is not responsible for an HOA, city, or other authority's independent lawful towing decision."
        },
        {
          "style": "Heading 3",
          "text": "10.10. Vehicle Repairs"
        },
        {
          "style": "Normal",
          "text": "Vehicle repairs, fluid changes, long-term parking, storage, washing that creates runoff problems, and commercial vehicle activity are prohibited on the Premises or common areas unless Landlord gives written permission and the activity complies with law and HOA rules. Emergency tire changes or battery jumps may be allowed if completed promptly and safely."
        },
        {
          "style": "Heading 3",
          "text": "10.11. Parking Liability"
        },
        {
          "style": "Normal",
          "text": "Landlord does not insure Tenant's vehicles or vehicle contents and does not guarantee against theft, vandalism, weather damage, towing, collision, or other loss. Tenant should maintain appropriate vehicle insurance."
        }
      ]
    }
  ]
}
