{
  "$schema": "../../schemas/clause-definition.schema.json",
  "schema_version": "1.0.0",
  "clause_type": "General Provisions",
  "clause_name": "RLA-530 — Residential Lease — Subordination, Transfer, and Estoppel",
  "zoho_api_name": null,
  "zoho_api_name_status": "tenant_verification_required",
  "library_question": "Do the standard lawful subordination, ownership-transfer, attornment, and reasonable estoppel provisions apply?",
  "contract_type_question_overrides": [],
  "language_variants": [
    {
      "variant_id": "standard",
      "variant_kind": "standard",
      "clause_title": "12.6. Subordination, Transfer, and Attornment",
      "clause_title_style": "Heading 2",
      "blocks": [
        {
          "style": "Normal",
          "text": "This Lease is subordinate to existing and future mortgages, deeds of trust, and security interests only to the extent allowed by law. After written notice of an ownership or management change, Tenant shall recognize a lawful successor and continue Lease performance. Nothing in this section waives or reduces a bona fide tenant's rights under the Protecting Tenants at Foreclosure Act or another applicable foreclosure law."
        },
        {
          "style": "Heading 3",
          "text": "12.7. Estoppel Certificate"
        },
        {
          "style": "Normal",
          "text": "Within ten (10) business days after Landlord's written request, Tenant must sign a reasonable estoppel certificate confirming the Lease status, Rent amount, deposit amount, known defaults, occupants, and other lease facts reasonably requested for sale, financing, refinancing, insurance, or legal compliance. Tenant may identify good-faith disputes in the certificate."
        }
      ]
    }
  ]
}
