{
  "$schema": "../../schemas/clause-definition.schema.json",
  "schema_version": "1.0.0",
  "clause_type": "General Provisions",
  "clause_name": "RLA-590 — Residential Lease — Severability, Entire Agreement, and Interpretation",
  "zoho_api_name": null,
  "zoho_api_name_status": "tenant_verification_required",
  "library_question": "Do the standard severability, entire-agreement, defined-scope, and interpretation provisions apply?",
  "contract_type_question_overrides": [],
  "language_variants": [
    {
      "variant_id": "standard",
      "variant_kind": "standard",
      "clause_title": "12.17. Severability",
      "clause_title_style": "Heading 2",
      "blocks": [
        {
          "style": "Normal",
          "text": "If any provision of this Lease is held invalid or unenforceable, the provision will be limited or reformed to the minimum extent necessary to make it lawful if possible, and the remainder of the Lease will remain enforceable."
        },
        {
          "style": "Heading 3",
          "text": "12.18. Entire Agreement"
        },
        {
          "style": "Normal",
          "text": "This Lease and signed addenda constitute the entire agreement between Landlord and Tenant regarding the Premises and supersede prior oral or written statements about the tenancy. Tenant is not relying on any promise, representation, or statement not contained in this Lease or a signed addendum."
        },
        {
          "style": "Heading 3",
          "text": "12.19. Interpretation"
        },
        {
          "style": "Normal",
          "text": "Section headings are for convenience only and do not limit the text. Singular includes plural and plural includes singular where appropriate. Any reference to Tenant includes all Tenants, occupants, guests, invitees, pets, and Tenant's property where context requires. Any rights reserved to Landlord are subject to applicable law."
        }
      ]
    }
  ]
}
